{
  "task_id": "jacobian/hermite-normal-form",
  "conclusion": "TRUE",
  "result": {
    "normal_form": [[2, 0], [0, 4]],
    "transformation": [[-2, 1], [3, -1]]
  },
  "claimed_assurance": "VERIFIED",
  "scope": "jacobian/hermite-normal-form complete finite input",
  "completeness": "COMPLETE",
  "evidence": [
    {
      "path": "evidence/answer.txt",
      "sha256": "sha256:3414e50456f0467762b8b465b359edacb5f76765ebccd0403215d9c588969376"
    }
  ],
  "verification_record_uri": {
    "path": "evidence/verification-record.json",
    "sha256": "sha256:07821bfec4e0366315bf6b77a82136e6380df6919a4e1abb48832964331d9b66"
  },
  "limitations": []
}
